{
  "schema_version": "0.1",
  "profile_id": "generic-unified-32gib",
  "name": "Generic Unified Memory System (32 GiB)",
  "vendor": "generic",
  "family": "unified-memory",
  "aliases": ["unified-32gb", "unified-32gib"],
  "memory_topology": "unified",
  "total_memory": {
    "value": "32",
    "unit": "GiB"
  },
  "reserves": {
    "os_reserve": { "lower_bytes": 2147483648, "expected_bytes": 4294967296, "upper_bytes": 6442450944 },
    "display_reserve": { "lower_bytes": 268435456, "expected_bytes": 536870912, "upper_bytes": 1073741824 },
    "background_process_reserve": { "lower_bytes": 536870912, "expected_bytes": 1073741824, "upper_bytes": 2147483648 },
    "device_specific_reserve": { "lower_bytes": 0, "expected_bytes": 0, "upper_bytes": 0 }
  },
  "recommended_headroom_ratio": {
    "lower": "0.10",
    "expected": "0.15",
    "upper": "0.20"
  },
  "supported_backend_ids": ["llama_cpp", "vllm"],
  "notes": ["Generic 32 GiB unified memory profile."],
  "evidence": [
    {
      "evidence_id": "generic-unified-32gib-spec",
      "source_type": "theoretical_spec",
      "source": "Standard 32 GiB unified memory architecture",
      "notes": "Unified memory reserve estimates."
    }
  ],
  "confidence": "unknown",
  "status": "unverified"
}
